<?xml version="1.0" encoding="UTF-8"?>
<xs:schema xmlns:xs="http://www.w3.org/2001/XMLSchema">
    <xs:element name="empleados">
        <xs:complexType>
            <xs:sequence>
                <xs:element name="empleado" maxOccurs="unbounded">
                    <xs:complexType>
                        <xs:sequence>
                            <xs:element name="nombre" type="xs:string" />
                            <xs:element name="departamento" type="xs:string" />
                            <xs:element name="salario" type="xs:decimal" /> 
                        </xs:sequence>
                        <xs:attribute name="id" type="xs:ID" use="required" />
                    </xs:complexType>
                </xs:element>
            </xs:sequence>
        </xs:complexType> 
    </xs:element>
</xs:schema>
