<?xml version="1.0" encoding="UTF-8"?>
<empleados xmlns:xsi="http://www.w3.org/2001/XMLSchema-instance"
           xsi:noNamespaceSchemaLocation="empleados.xsd">
    <empleado id="e1">
        <nombre>Juan Perez</nombre>
        <departamento>Desarrollo</departamento>
        <salario>3000</salario>
    </empleado>
    <empleado id="e2">
        <nombre>Mar√≠a Rodriguez</nombre>
        <departamento>Marketing</departamento>
        <salario>2500</salario>
    </empleado>
    <empleado id="e3">
        <nombre>Carlos Sanchez</nombre>
        <departamento>Recursos Humanos</departamento>
        <salario>2800</salario>
    </empleado>
</empleados>